Donald Trump,"Says N.Y. Gov. Andrew Cuomo “rejected buying recommended 16,000 ventilators in 2015 for the pandemic, for a pandemic, established death panels and lotteries instead. So, he had a chance to buy, in 2015, 16,000 ventilators at a very low price, and he turned it down.”","Donald Trump is the former president of the United States. He was elected the 45th president of the United States on Nov. 8, 2016.  He has been a real estate developer, entrepreneur and host of the NBC reality show, ""The Apprentice."" Trump's statements were awarded PolitiFact's 2015, 2017 and 2019 Lie of the Year. In November 2022, he announced he would run for president in 2024.","Trump said Cuomo ""rejected buying recommended 16,000 ventilators in 2015 for the pandemic, for a pandemic, established death panels and lotteries instead. So, he had a chance to buy, in 2015, 16,000 ventilators at a very low price and he turned it down."" A 2015 state report said that in the case of a ""severe"" pandemic, the state would be short about 16,000 ventilators during peak week. But the report did not recommend buying 16,000 ventilators, and did not indicate whether the state was at a fiscal position to purchase them. The state did not plan to increase its stockpile because it anticipated that in the event of a severe crisis, there would be shortage of trained staff to operate them and demand would outweigh any emergency stockpile. The report said the state had to balance the likely ventilator shortage with the need for adequate funding for current and ongoing health care expenses. The report issued guidelines on ventilator allocation if there weren’t enough for everyone and suggested that hospitals designate a triage officer or committee. It explored a lottery system, but did not recommend it as the primary option. Cuomo did not establish one. ",Miriam Valverde,https://www.politifact.com/factchecks/2020/mar/25/donald-trump/donald-trump-misses-key-facts-claim-new-york-gover/,false
Facebook posts,Says Gov. Tony Evers is “pushing firearm confiscation orders”,"Posters on Facebook and other social media networks.
 ","A year-old story now circulating again on Facebook says Evers is ""pushing firearm confiscation orders."" That was an overreach in 2019, and it’s even more absurd now. The article was referring to red flag laws, but at the time of this post Evers hadn’t proposed one yet. And more importantly, red flag laws are a far cry from the implication this headline gives of some form of widespread gun confiscation. ",Eric Litke,https://www.politifact.com/factchecks/2020/mar/25/facebook-posts/old-claim-tony-evers-and-gun-confiscation-wrong/,pants-fire
Donald Trump,Says Nancy Pelosi’s coronavirus bill includes “tax credits for solar and wind energy … retirement plans for community newspaper employees … $300 million for PBS … climate change studies” and more.,"Donald Trump is the former president of the United States. He was elected the 45th president of the United States on Nov. 8, 2016.  He has been a real estate developer, entrepreneur and host of the NBC reality show, ""The Apprentice."" Trump's statements were awarded PolitiFact's 2015, 2017 and 2019 Lie of the Year. In November 2022, he announced he would run for president in 2024.","The campaign ad says that Pelosi’s coronavirus bill included provisions on ""tax credits for solar and wind energy … emissions standards and carbon offset requirements for airlines … policing racial makeup of corporate boards … retirement plans for community newspaper employees … $300 million for PBS … climate change studies for civil aviation and aerospace industries."" ",Louis Jacobson,https://www.politifact.com/factchecks/2020/mar/24/donald-trump/trump-campaign-ad-mostly-right-provisions-pelosis-/,mostly-true
Bloggers,“Fish tank additive may treat coronavirus.”,Blog posting on the Internet,"A Valley News Live headline said, ""Fish tank additive may treat coronavirus."" Chloroquine, a compound commonly found in fish-tank cleaners, also forms the basis of a prescription drug used for malaria. There are studies underway to conclude whether that drug, and a variant called hydroxychloroquine, could combat the coronavirus. But the fish-tank cleaner is not the same as the prescription drug, and it shouldn’t be substituted as such. A man in Arizona recently died from ingesting it. ",Bill McCarthy,https://www.politifact.com/factchecks/2020/mar/24/blog-posting/drinking-chloroquine-fish-tank-cleaner-wont-stop-c/,false
JB Pritzker,Says it was “unquestionably” not within his “legal authority” to postpone Illinois’ primary election by changing the date or shifting to vote-by-mail.,J.B. Pritzker is Illinois' 43rd governor and a former Chicago venture capitalist and entrepreneur.,"Pritzker said it was ""unquestionably"" not within his ""legal authority"" to postpone Illinois’ primary election by changing the date or shifting the election to vote-by-mail. While there are too many hypotheticals to be certain Pritzker’s administration could not have delayed the election in any way, experts told us the governor spoke correctly in describing the limits of his powers under state law. ",Kiannah Sepeda-Miller,https://www.politifact.com/factchecks/2020/mar/24/jb-pritzker/did-pritzker-lack-authority-postpone-illinois-prim/,mostly-true
Instagram posts,"“Putin has stated: Russian citizens (have) 2 options: Stay home for 15 days or in jail for 5 years.”
","Posters on Instagram, where people share photos and graphics and sometimes add filters.","Social media posts have said ""Putin has stated: Russian citizens (have) 2 options: Stay home for 15 days or in jail for 5 years."" Credible news accounts and experts on the region see no evidence of such a draconian choice in Russia. The claim appears to stem from a post by an Indian comedian, who later clarified that this was intended as a ""joke."" ",Louis Jacobson,https://www.politifact.com/factchecks/2020/mar/24/instagram-posts/putin-didnt-threaten-jail-time-coronavirus-lockdow/,false
Facebook posts,"""U.S. deaths since 1/22 (2020): COVID-19: 27, flu, 4,700; abortion: 118,000.""","Posters on Facebook and other social media networks.
 ","Precise numbers for Jan. 22, 2020, through March 17, 2020, are not available in any of the three categories. It’s generally true that the number of abortions in the United States far outpaces the number of deaths to COVID-19 or the flu. But the numbers included in this post are not in line with the best data. Abortion is an elective procedure, not a disease. ",Tom Kertscher,https://www.politifact.com/factchecks/2020/mar/24/facebook-posts/post-leans-flawed-numbers-compare-number-abortions/,barely-true
Facebook posts,"""Huge! Results From Breaking Chloroquine Study Show 100% Cure Rate For Patients Infected With The Coronavirus.""","Posters on Facebook and other social media networks.
 ","A Facebook post claimed results from a chloroquine study show a ""100% cure rate for patients infected with the coronavirus."" The French study of the drug on 20 patients with COVID-19 indicates it could help with treatment, but it is no sure cure. U.S. health experts stress the results are preliminary and much more research is needed.  ",Tom Kertscher,https://www.politifact.com/factchecks/2020/mar/23/facebook-posts/100-covid-19-cure-no-chloroquine-effectiveness-onl/,false
Facebook posts,"“So Oscar Health, the company tapped by Trump to profit from covid tests, is a Kushner company. Imagine that, profits over national safety.”","Posters on Facebook and other social media networks.
 ","A Facebook post says: ""So Oscar Health, the company tapped by Trump to profit from covid tests, is a Kushner company. Imagine that, profits over national safety."" The Kushner family is connected to Oscar Health, a health insurance company that recently launched a website to help locate nearby testing centers for the novel coronavirus.  Business Insider reported that Oscar Health shared the code it developed with HHS after it made its online portal public. But we found no evidence that Trump formally designated the company to help with the White House’s COVID-19 testing efforts. ",Bill McCarthy,https://www.politifact.com/factchecks/2020/mar/23/facebook-posts/what-kushner-linked-company-has-do-coronavirus-tes/,half-true
Dan Crenshaw,Says longstanding Food and Drug Administration regulations “created barriers to the private industry creating a test quickly” for the coronavirus.,U.S. Rep. Dan Crenshaw represents the 2nd Congressional District in Texas.,"Crenshaw said in a tweet that longstanding FDA regulations ""created barriers to the private industry creating a test quickly"" for the coronavirus. Crenshaw’s statement is accurate. FDA procedures adopted in 2004 meant laboratories had to seek the agency’s approval before developing and using tests in communities, a policy many health care officials have said prevented the country from taking early action in response to the novel coronavirus. It is important to keep in mind that other factors have contributed to the low levels of testing for the virus, beyond the FDA regulations. ",Madlin Mekelburg,https://www.politifact.com/factchecks/2020/mar/23/dan-crenshaw/did-fda-regulations-slow-testing-coronavirus/,true
Facebook posts,“Wisconsin is the only state where all Republicans voted against protecting its citizens.”,"Posters on Facebook and other social media networks.
 ","A viral Facebook post said Wisconsin ""is the only state where all Republicans voted against protecting its citizens."" It is indeed the only state where all Republicans opposed the bill, which has now become law. But it’s a bit of an exaggeration to summarize their decisions as a vote ""against protecting (Wisconsin) citizens."" And of course this is expected to be just the first of many bills addressing the coronavirus fallout.  ",Eric Litke,https://www.politifact.com/factchecks/2020/mar/20/facebook-posts/yes-wisconsin-only-state-where-all-republicans-opp/,mostly-true
Andrew Cuomo,“No city in the state can quarantine itself without state approval.”,"Andrew Cuomo, a Democrat, was elected to his first term as governor of New York in 2010.
",Cuomo said that cities do not have the power to order quarantines without state approval.  ,Jill Terreri Ramos,https://www.politifact.com/factchecks/2020/mar/20/andrew-cuomo/cuomo-correctly-says-no-quarantine-without-state-a/,true
Marco Rubio,For coronavirus cases “in the U.S. 38% of those hospitalized are under 35.”,"Marco Rubio, a U.S. senator from Florida, was a candidate for president of the United States in 2016 and then dropped out and won re-election to the Senate. He was first elected to the Senate in 2010 and took office Jan. 5, 2011. Rubio served in the Florida House of Representatives from 2000 to 2008 and is a former Speaker of the Florida House. He served on the West Miami City Commission from 1998 to 2000. He is from Miami and holds a law degree from the University of Miami.
","Rubio tweeted ""in the U.S. 38% of those hospitalized are under 35."" We could not find any current data that matches Rubio’s tweet. It is possible that he was citing widely reported data that included people up to age 54. The CDC reported that 20% of the hospitalizations were ages 20-44 and 18% were 45-54. But the data is preliminary, so it’s challenging to draw conclusions at this stage about the ages of people hospitalized.  Rubio’s office didn’t get back to us but we have to wonder if the mistake in his tweet amounted to a simple transcription error. ",Amy Sherman,https://www.politifact.com/factchecks/2020/mar/20/marco-rubio/young-people-are-being-hospitalized-covid-19-too-l/,barely-true
Greg Murphy,“Sunlight actually can kill the (novel coronavirus.)”,"Rep. Greg Murphy is a Republican from Greenville and the only North Carolina legislator who is a medical doctor. Murphy is a practicing surgeon.
","Murphy said ""sunlight actually can kill the virus."" This claim has not been proven true. His whiteboard mentioned UV light in sunlight. But experts claim the UV rays in sunlight aren’t intense enough to COVID-19. ",Paul Specht,https://www.politifact.com/factchecks/2020/mar/20/greg-murphy/no-sunlight-has-not-been-proven-kill-coronavirus/,false
Donald Trump,"Says that “over a 45-minute period that we had the press conference” on the coronavirus on March 13, 2020, the stock market set ""an all-time record.""","Donald Trump is the former president of the United States. He was elected the 45th president of the United States on Nov. 8, 2016.  He has been a real estate developer, entrepreneur and host of the NBC reality show, ""The Apprentice."" Trump's statements were awarded PolitiFact's 2015, 2017 and 2019 Lie of the Year. In November 2022, he announced he would run for president in 2024.","Trump said that ""over a 45-minute period that we had the press conference"" on the coronavirus on March 13, 2020, the stock market set ""an all-time record."" The Dow Jones Industrial Average registered its largest-ever point gain on March 13, with gains accelerating during Trump’s news conference. But that occurred one day after the Dow’s biggest point decline ever, and the gains were wiped out the next trading day.  ",Tom Kertscher,https://www.politifact.com/factchecks/2020/mar/19/donald-trump/stock-market-record-point-rise-followed-record-poi/,half-true
David A. Clarke Jr.,Says coronavirus is just “the damn flu.”,David A. Clarke Jr. served as Milwaukee County sheriff from 2002 to 2017.,"Ranting against those who would ""err on the side of caution,"" Clarke claimed coronavirus is just the ""damn flu."" There is indeed overlap in some basic areas — what symptoms it causes, how it is spread, who is most at risk, etc. But those pale in light of the stark differences. There is no vaccine for coronavirus. Treatment approaches are not as well established. And most critically, someone who contracts COVID-19 is at least 20 times more likely to die of the disease than someone with the flu, based on the best available data. The overall theme from Clarke’s tweetstorm was that the coronavirus is no big deal — that the disease is just the same old flu virus with a heaping spoonful of government overreach. That flies in the face of lots of established science, as well as what nations like China and Italy have already experienced. ",Eric Litke,https://www.politifact.com/factchecks/2020/mar/19/david-clarke-jr/former-sheriff-david-clarke-rants-coronavirus-just/,pants-fire
Donald Trump,"The coronavirus ""snuck up on us,” adding that it is “a very unforeseen thing.”","Donald Trump is the former president of the United States. He was elected the 45th president of the United States on Nov. 8, 2016.  He has been a real estate developer, entrepreneur and host of the NBC reality show, ""The Apprentice."" Trump's statements were awarded PolitiFact's 2015, 2017 and 2019 Lie of the Year. In November 2022, he announced he would run for president in 2024.","President Donald Trump said COVID-19 ""snuck up on us,"" and was ""a very unforeseen thing."" In fact, the president heard warnings about this specific virus from his advisers and the global health community for months. And public health and national security experts had been highlighting the risks for even longer about the threat of some kind of pandemic – even if the details weren’t yet known. Indeed, it is because of Trump’s slow response to the pandemic that ""social distancing"" is now required at such a large-scale level. Earlier, more focused testing and sequestering of people with the virus could have mitigated some of the response now required, experts told us. ",Shefali Luthra,https://www.politifact.com/factchecks/2020/mar/19/donald-trump/was-novel-coronavirus-really-sneaky-its-spread-us-/,pants-fire
Donald Trump,"“I've always known this is a real, this is a pandemic. I've felt it was a pandemic long before it was called a pandemic.”","Donald Trump is the former president of the United States. He was elected the 45th president of the United States on Nov. 8, 2016.  He has been a real estate developer, entrepreneur and host of the NBC reality show, ""The Apprentice."" Trump's statements were awarded PolitiFact's 2015, 2017 and 2019 Lie of the Year. In November 2022, he announced he would run for president in 2024.","Trump said that he’s ""always known this is a real, this is a pandemic. I've felt it was a pandemic long before it was called a pandemic.""  Until late February, Trump spoke as though the U.S. problem was limited and well under control. That description is at odds with the nature of a pandemic. We can’t know what was in Trump’s mind when he aimed to reassure the public, but his words did not fit with the threat of a pandemic. ",Jon Greenberg,https://www.politifact.com/factchecks/2020/mar/18/donald-trump/trump-says-he-always-felt-coronavirus-was-pandemic/,pants-fire
Facebook posts,“Italy has decided not to treat their elderly for this virus.”,"Posters on Facebook and other social media networks.
 ","A Facebook post claiming Italy had decided to stop treating elderly COVID-19 patients goes too far. Overwhelmed by the number of cases, the country was relying on guidelines to give priority for some treatments, such as ventilators, to those patients most likely to survive.  ",Tom Kertscher,https://www.politifact.com/factchecks/2020/mar/18/facebook-posts/italys-overwhelmed-hospitals-are-treating-elderly-/,barely-true
Ron Paul,"Says Anthony Fauci’s statement that the coronavirus death rate is 10 times that of the seasonal flu is “a claim without any scientific basis.""","Ron Paul, a Texas physician, served two stints in the U.S. House. He also was the Libertarian Party nominee for president in 1988 before later seeking the Republican presidential nomination in 2008 and 2012. He didn't seek re-election to the House in 2012.
","Paul said that Anthony Fauci’s statement that the coronavirus death rate is 10 times that of the seasonal flu is ""a claim without any scientific basis."" ",Tom Kertscher,https://www.politifact.com/factchecks/2020/mar/18/ron-paul/ron-paul-wrong-say-no-basis-coronavirus-death-rate/,false
Sean Hannity,"“Now, as it stands, our health care system has adequate ventilators, ICU beds, medical professionals.”","Sean Hannity is a conservative political commentator and hosts a nationally syndicated radio show, as well as two television shows on the Fox News Channel. In a 2013 interview Hannity said that he is a “registered Conservative” and ”not a Republican, though people often mistake me for one.” Hannity has authored three books.","Hannity said, ""Now, as it stands, our health care system has adequate ventilators, ICU beds, medical professionals."" That might be true if the U.S. stopped the coronavirus from spreading any further. But given the country’s likely trajectory, experts said all evidence points to the U.S. being short on beds, ICUs, ventilators and medical professionals. The U.S. will need to take steps to slow the spread and expand hospital capacity if it wants to keep its health care system from being overrun by the likely uptick in cases. ",Bill McCarthy,https://www.politifact.com/factchecks/2020/mar/18/sean-hannity/hannity-wrong-health-care-system-ready-coronavirus/,barely-true
Kelly Alexander,"Says ""most"" NC legislators are in the ""high risk age group"" for coronavirus",Kelly Alexander Jr. is a funeral director who represents District 107 in the North Carolina House of Representatives.,"Rep. Alexander said ""most"" North Carolina legislators are in the ""highest risk age group"" for coronavirus. ",Paul Specht,https://www.politifact.com/factchecks/2020/mar/18/kelly-alexander/most-nc-legislators-high-risk-age-group-coronaviru/,true
Donald Trump, The WHO coronavirus test “was a bad test.”,"Donald Trump is the former president of the United States. He was elected the 45th president of the United States on Nov. 8, 2016.  He has been a real estate developer, entrepreneur and host of the NBC reality show, ""The Apprentice."" Trump's statements were awarded PolitiFact's 2015, 2017 and 2019 Lie of the Year. In November 2022, he announced he would run for president in 2024.","Trump said that the coronavirus test used by WHO ""was a bad test."" In the lab, the test was found to produce neither false positives nor negatives. The White House produced no evidence that the test under-performed. ",Jon Greenberg,https://www.politifact.com/factchecks/2020/mar/17/donald-trump/donald-trump-falsely-says-who-coronavirus-test-was/,false
Instagram posts,"Says Donald Trump “cut funding to the CDC,” “fired the Pandemic Response Team,” “refused WHO tests” and “wasted two weeks calling this outbreak a ‘Democrat hoax.’”","Posters on Instagram, where people share photos and graphics and sometimes add filters.","An Instagram post made four claims that criticize Trump’s response to the COVID-19 pandemic. The first, that he ""cut funding to the CDC,"" is partially accurate; Trump tried to cut the agency’s funding, but Congress prevented it from happening. On the second claim, while saying Trump ""fired"" the ""Pandemic Response Team"" is a stretch, it’s true that National Security Council staffers left abruptly in 2018 and were not replaced.  The third claim, that Trump ""refused WHO tests,"" contains a hint of truth, but is mostly inaccurate since the U.S. does not usually rely on the WHO for testing protocols. And the fourth claim, which says Trump ""wasted two weeks calling this outbreak a ‘Democrat hoax,’"" is inaccurate — the president has not called the virus itself a ""hoax,"" just the Democrats’ response to it. ",Daniel Funke,https://www.politifact.com/factchecks/2020/mar/17/instagram-posts/celebrities-are-sharing-misleading-post-about-trum/,barely-true
Joe Biden,The World Health Organization offered the testing kits that they have available and to give it to us now. We refused them. We did not want to buy them.”,"Joe Biden is the president of the United States. A Democrat, Biden served as a Delaware senator from 1973 (elected at the age of 29) until 2009. During his time in the Senate, he served as chair of the Foreign Relations Committee, chair of the International Narcotics Control Caucus and chair of the Judiciary Committee. He subsequently served as Barack Obama’s vice president from 2009 to 2016. Biden launched unsuccessful presidential campaigns in 1988 and 2008. He received a degree in history and political science from the University of Delaware and his J.D. from Syracuse School of Law. ","Biden said, ""The World Health Organization offered, offered the testing kits that they have available and to give it to us now. We refused them. We did not want to buy them.""  Biden has a point that the U.S. did not attempt to use the WHO test. But the U.S. would never have needed complete kits from WHO. Even if it had adopted the WHO testing approach, it already had access to all the necessary materials.  WHO said there was never any talk of WHO sending testing kits to the United States. Biden’s words leave out other important context and information.  The U.S. chose to use its own test, rather than the one circulated by WHO. Other nations, such as China, Japan and France, also developed their own tests. Multiple public health experts said that is not unusual.  ",Jon Greenberg,https://www.politifact.com/factchecks/2020/mar/16/joe-biden/biden-falsely-says-trump-administration-rejected-w/,barely-true
Bloggers,“The CDC can detain anyone with a fever — indefinitely. … Vaccination (is) a way people could get out of detention.”,Blog posting on the Internet,"Claims on the internet said ""the CDC can detain anyone with a fever — indefinitely. … Vaccination (is) a way people could get out of detention."" The CDC does have the power to isolate people with certain infectious diseases and quarantine those who had contact with an infected person. But this claim is wrong or misleading about many of the details. ",Louis Jacobson,https://www.politifact.com/factchecks/2020/mar/16/blog-posting/clarifying-whats-accurate-and-not-claims-about-qua/,false
Facebook posts,“‘The Simpsons' predicted Tom Hanks getting coronavirus in 2007.”,"Posters on Facebook and other social media networks.
 ","In the closing credits of ""The Simpsons Movie"" from that year, Hanks’ character says: ""This is Tom Hanks, saying, if you see me in person, leave me be.""  ",Tom Kertscher,https://www.politifact.com/factchecks/2020/mar/16/facebook-posts/simpsons-did-not-predict-tom-hanks-illness-coronav/,false
Bloggers,Says Nancy Pelosi was “caught trying to include abortion funding in bill to combat coronavirus.”,Blog posting on the Internet,"A website claims Pelosi was ""caught trying to include abortion funding"" in the bill.  This is inaccurate. A section in the bill seeks to reimburse insurers for COVID-19 related laboratory claims. Concerns were raised that the bill’s language could inadvertently open up federal funds for abortion services, but it’s unclear exactly how. No draft of the legislation had funding for abortion in it.   ",Samantha Putterman,https://www.politifact.com/factchecks/2020/mar/16/blog-posting/no-pelosi-wasnt-caught-trying-add-abortion-funding/,false
