Joe Biden,"""There was virtually no new business investment"" after the 2017 tax law. ""The bulk was used to buy back their own stock.""","Joe Biden is the president of the United States. A Democrat, Biden served as a Delaware senator from 1973 (elected at the age of 29) until 2009. During his time in the Senate, he served as chair of the Foreign Relations Committee, chair of the International Narcotics Control Caucus and chair of the Judiciary Committee. He subsequently served as Barack Obama’s vice president from 2009 to 2016. Biden launched unsuccessful presidential campaigns in 1988 and 2008. He received a degree in history and political science from the University of Delaware and his J.D. from Syracuse School of Law. ","Biden said, ""There was virtually no new business investment"" after the 2017 tax law. ""The bulk was used to buy back their own stock."" Economists agree that business investment after the tax law has been underwhelming, but it was an exaggeration for Biden to say there was virtually none. Investment did increase, especially in the goods-producing sector. As for stock buybacks, a new record was set in 2018, but research suggests that it was driven by particularly large buybacks by a small number of firms, rather than a broad swath of companies. This casts doubt on Biden’s contention that the buybacks consumed ""the bulk"" of the tax law’s proceeds. ",Louis Jacobson,https://www.politifact.com/factchecks/2019/feb/04/joe-biden/did-tax-bill-lead-virtually-no-new-business-invest/,half-true
Andrew Cuomo,"""There is nothing that we have done on Amazon that we have not done with hundreds of other projects.""","Andrew Cuomo, a Democrat, was elected to his first term as governor of New York in 2010.
","Gov. Andrew Cuomo said that the incentives offered to Amazon are the same as those offered to ""hundreds"" of other companies. We looked at the state subsidies, and found that other companies have been offered the types of subsidies offered to Amazon. However, the scale of the subsidies is larger, including a discretionary capital grant, than many prior projects the state has done. The general project plan process, which has been criticized because it does not require approval from City Council, has also been used on hundreds of statewide projects that have been awarded capital construction grants. ",Jill Terreri Ramos,https://www.politifact.com/factchecks/2018/dec/07/andrew-cuomo/cuomo-said-treatment-amazon-no-different/,true
Kathy Manning,"""I'm not taking any corporate PAC money.""","Kathy Manning is a candidate for Congress in North Carolina's 13th Congressional District.
","Kathy Manning said ""I’m not taking any corporate PAC money. I don’t want to be beholden to corporations."" Manning is technically correct that she hasn’t taken any corporate PAC money. But she has taken money from other PACs, including from non-corporate PACs that are funded by corporate PACs. Furthermore, what Manning fails to mention is that corporate PACs are not funded by corporations themselves, but rather by the employees of those corporations. And she has taken plenty of money from employees of large corporations, including the CEOs of companies in industries like investment banking, real estate, chemicals and tech. ",Will Doran,https://www.politifact.com/factchecks/2018/oct/28/kathy-manning/beto-orourke-nc-democrat-kathy-manning-claims-no-c/,half-true
Tammy Baldwin,"Under the Republican tax reform law, ""83 percent of the benefits go to the top 1 percent of individuals and large multinational corporations.""
 ","Tammy Baldwin was elected to the U.S. Senate on Nov. 6, 2012. She represented Wisconsin’s Second Congressional District from January 1999 to January 2013. She served as a member of the Wisconsin Assembly from January 1993 to January 1999. She was a Dane County supervisor from 1986 to 1994 and briefly served on the Madison Common Council, filling a vacancy, in 1986.","Baldwin says that under the Republican tax reform law, ""83 percent of the benefits go to the top 1 percent of individuals and large multinational corporations."" Even though her statement mentions corporations, it isn’t materially different than three similar statements we’ve checked. In a nutshell, the analysis that all four statements rely on found that by 2027, the law would deliver 82.8 percent of its benefits to the top 1 percent of the income spectrum. However, in earlier years, the distribution of benefits would look very different, with much smaller percentages of the benefits  — 20 to 25 percent — going to the top 1 percent. ",Tom Kertscher,https://www.politifact.com/factchecks/2018/oct/26/tammy-baldwin/tammy-baldwin-partially-accurate-claiming-83-gop-t/,half-true
Tammy Baldwin,"""2.4 million people in Wisconsin have pre-existing conditions"" and Leah Vukmir supports letting insurance companies ""deny coverage to people with pre-existing conditions.""
 ","Tammy Baldwin was elected to the U.S. Senate on Nov. 6, 2012. She represented Wisconsin’s Second Congressional District from January 1999 to January 2013. She served as a member of the Wisconsin Assembly from January 1993 to January 1999. She was a Dane County supervisor from 1986 to 1994 and briefly served on the Madison Common Council, filling a vacancy, in 1986.","Baldwin said ""2.4 million people in Wisconsin have pre-existing conditions"" and Vukmir supports letting insurance companies ""deny coverage to people with pre-existing conditions."" There is some basis for the first part of Baldwin’s statement. One estimate puts the number of at 2.4 million — but those that could be denied health insurance coverage because of a condition is estimated to be much smaller, 852,000. On the second part of Baldwin’s statement, Vukmir has indicated that high-risk pools are a solution for covering people with pre-existing conditions. But those were in place because -- before the Affordable Care Act, which Vukmir wants to repeal -- insurers were allowed to deny coverage to people with pre-existing conditions. And Wisconsin’s high-risk pool covered only a fraction of people with pre-existing conditions. That being said, Vukmir has not specifically said she supports allowing insurers to deny coverage to people with pre-existing conditions, and she has said those should be covered  — even if she has been vague about how that would happen. ",Tom Kertscher,https://www.politifact.com/factchecks/2018/oct/08/tammy-baldwin/does-leah-vukmir-support-letting-insurers-deny-cov/,half-true
Tammy Baldwin,"Says Leah Vukmir was ""just about the only legislator who stood with the insurance companies"" and ""voted against oral chemotherapy.""
 ","Tammy Baldwin was elected to the U.S. Senate on Nov. 6, 2012. She represented Wisconsin’s Second Congressional District from January 1999 to January 2013. She served as a member of the Wisconsin Assembly from January 1993 to January 1999. She was a Dane County supervisor from 1986 to 1994 and briefly served on the Madison Common Council, filling a vacancy, in 1986.","Baldwin says Vukmir was ""just about the only legislator who stood with the insurance companies"" and ""voted against oral chemotherapy."" On the main vote on a chemotherapy bill, Vukmir aligned with insurance companies that opposed the bill and was one of two state senators to vote no. That said, Vukmir’s vote wasn’t against oral chemotherapy. It was against stopping insurers from charging patients higher deductibles, copayments or coinsurance for oral chemotherapy than they would pay for traditional chemotherapy. ",Tom Kertscher,https://www.politifact.com/factchecks/2018/sep/14/tammy-baldwin/insurers-leah-vukmir-opposed-wisconsin-law-forcing/,mostly-true
Jeff Williams,"The new Apple Watch Series 4 includes ""the first ECG product offered over-the-counter directly to consumers.""","Jeff Williams is Apple's chief operating officer.
","Apple Chief Operating Officer Jeff Williams said the new Apple Watch Series 4 ""is the first ECG product offered over-the-counter directly to consumers."" That claim ignores the fact that start-up AliveCor has produced over-the-counter ECG devices for several years. The AliveCor device requires a cardiologist to review the first test, while that won’t be necessary for the Apple watch. This is a very subtle distinction and not enough to stand up Williams’ claim. ",Chris Nichols,https://www.politifact.com/factchecks/2018/sep/14/jeff-williams/apple-beat-claim-about-first-ekg-consumer-product/,false
Tammy Baldwin,"""New reports show Kevin Nicholson made over $1 million advising companies that shut down Wisconsin plants and laid off 1,900 people.""
 ","Tammy Baldwin was elected to the U.S. Senate on Nov. 6, 2012. She represented Wisconsin’s Second Congressional District from January 1999 to January 2013. She served as a member of the Wisconsin Assembly from January 1993 to January 1999. She was a Dane County supervisor from 1986 to 1994 and briefly served on the Madison Common Council, filling a vacancy, in 1986.","Baldwin says: ""New reports show Kevin Nicholson made over $1 million advising companies that shut down Wisconsin plants and laid off 1,900 people.""

An Associated Press report said Nicholson worked as a consultant for companies that laid off nearly 1,900 people since 2015, shutting down plants in Wisconsin and other states. And it says Nicholson received more than $1 million for his consulting work between January 2016 and November 2017. But it doesn’t say how much he was paid for consulting for the companies that did layoffs and shutdowns. In short, Baldwin cites no evidence to show how much money Nicholson was paid consulting for those companies. And we don’t know whether Nicholson’s work had anything to do with the layoffs and the shutdowns. There’s simply no evidence of what he did for those companies. ",Tom Kertscher,https://www.politifact.com/factchecks/2018/aug/07/tammy-baldwin/tammy-baldwin-ad-claiming-kevin-nicholson-made-1-m/,barely-true
Matt Flynn,On whether he would seek to undo the Foxconn deal.,"Milwaukee attorney Matt Flynn announced in October 2017 that he is running for the Democratic nomination for governor of Wisconsin in the 2018 election. A former chairman of the Wisconsin Democratic Party, Flynn lost bids for the U.S. Senate in 1986 and 1988 and was defeated in contests for the U.S. House of Representatives in 1978 and 2004. 
","While Flynn says otherwise, his public statements on the Foxconn deal have not been consistent. Before the deal was approved, he wanted to reopen it. Once it was approved, he indicated he would ""live up to contractual commitments"" and would not ""breach a contract."" More recently, he says the deal itself is ""illegal"" and ""unconstitutional"" and that he would stop the state's Foxconn deal ""no matter what."" We give Flynn a Full Flop. ",D.L. Davis,https://www.politifact.com/factchecks/2018/aug/02/matt-flynn/has-gubernatorial-candidate-matt-flynn-been-consis/,full-flop
Bernie Sanders,"""The three wealthiest people"" own ""more wealth than the bottom half of the American people.""","Bernie Sanders is a senator from Vermont. Sanders was first elected to the Senate in 2007 and was re-elected in 2012 and 2018. The senator also ran an unsuccessful presidential campaign in 2016, losing the Democratic primary to Hillary Clinton. From 1991 until 2007, he was the representative of Vermont’s At-Large District of the House of Representatives. Sanders was the mayor of Burlington from 1981 to 1989. He received a bachelor’s degree in political science from the University of Chicago. In 2019, he announced he was running for the Democratic nomination for president and dropped out in April 2020.","Sanders says: ""The three wealthiest people"" own ""more wealth than the bottom half of the American people."" The wealth of Gates, Bezos and Buffett exceeded that of the 160 million at the bottom of the scale, according to a 2017 study. And more recent estimates indicate the wealth of the three has since grown dramatically, widening the gap even more. ",Tom Kertscher,https://www.politifact.com/factchecks/2018/jul/19/bernie-sanders/bernie-sanders-bill-gates-jeff-bezos-warren-buffet/,true
Bloggers,"""Starbucks CEO: ‘If You Support Traditional Marriage We Don’t Want Your Business’""",Blog posting on the Internet,"A headline stated, ""Starbucks CEO: ‘If You Support Traditional Marriage We Don’t Want Your Business.’"" This is a claim that has circulated since 2013. At an annual meeting for company shareholders, Strobhar said the company’s support for same-sex marriage was eroding its bottom line, which prompted Schultz to defend his decision. Schultz said Strobhar was free to sell his Starbucks stocks and invest in another company if he believed the company’s social policies meant he could get a better return on his money elsewhere. He did not say opponents of same-sex marriage were not wanted as investors or as customers. ",Bill McCarthy,https://www.politifact.com/factchecks/2018/jun/05/blog-posting/what-starbucks-howard-schultz-said-about-same-sex-/,false
Tim Burns,"Says he is ""one of America's leading consumer lawyers.""
 ","Tim Burns, who lives in the Madison suburb of Middleton, has a national law practice representing businesses and individuals against insurers. In 2017, he announced he would run in 2018 for a seat on the Wisconsin Supreme Court.
","Burns says he is ""one of America's leading consumer lawyers."" The bulk of his legal work is not representing individual consumers, but rather large businesses that are suing their insurers. ",Tom Kertscher,https://www.politifact.com/factchecks/2018/feb/15/tim-burns/tim-burns-who-mostly-represents-businesses-suing-i/,false
Scott Walker,"Says Paul Soglin took Madison backward -- ""businesses have left and murders have gone up.""
 ","Scott Walker, a Republican, is the former governor of Wisconsin. He was first elected in November 2010. He survived a recall election in 2012, defeating Milwaukee Mayor Tom Barrett after igniting controversy with a bill curtailing public-employee union collective-bargaining rights.  He won re-election to a four-year term in November 2014 and was a 2016 presidential candidate before dropping out in September of 2015. He was defeated by Tony Evers in the 2018 gubernatorial election. Walker is a former Milwaukee County executive and former member of the state Assembly.","Walker says Soglin took Madison backward -- ""businesses have left and murders have gone up."" There are, of course, examples of businesses having left Madison, but the total number of businesses appears to be higher now than when Soglin took office. As for murders, they increased by two in 2016 and by three in 2017, hitting a record high of 11. But the two large companies cited by Walker that pulled out of Madison cited business reasons, not Soglin, for leaving. And while a mayor can play some role in combating homicides, primarily through a police department, there are many factors that lead to murder. ",Tom Kertscher,https://www.politifact.com/factchecks/2018/jan/31/scott-walker/scott-walkers-overstated-attack-governor-rival-pau/,barely-true
Paul Ryan,"""We've got about $3 trillion in trapped cash overseas that basically can't come back in this country because of our tax laws.""
 ","U.S. Rep. Paul Ryan, R.-Wis., became Speaker of the House in 2015 and served until his retirement in January 2019. Ryan was elected to represent southern Wisconsin in Congress in 1998 and for part of his tenure chaired the House Budget Committee. He was Mitt Romney's vice-presidential running mate in the 2012 presidential election. He did not seek re-election in 2018.","Ryan says: ""We've got about $3 trillion in trapped cash overseas that basically can't come back in this country because of our tax laws."" To avoid a 35 percent U.S. tax, U.S.-based multinational companies have opted not to ""repatriate"" roughly $3 trillion of their foreign profits, a figure that is growing. That is, they don’t bring the money back to their U.S. headquarters, where it can be used for things such as dividend payments or investments in their domestic operations. But the overseas profits aren’t literally trapped and indeed some foreign-earned profits are repatriated, though they are subject to the 35 percent tax. ",Tom Kertscher,https://www.politifact.com/factchecks/2017/sep/15/paul-ryan/paul-ryan-35-corporate-tax-rate-keeps-3-trillion-t/,mostly-true
Andy Gronik,"Wisconsin is ""guaranteeing Foxconn almost $3 billion, but Foxconn is not contractually guaranteeing how many full-time employees it will hire, for how long and at what pay.""","Democrat Andy Gronik, a businessman who lives in the Milwaukee suburb of Fox Point, announced in July 2017 that he would run for governor of Wisconsin in 2018 in his first run for public office. He dropped out of the race on June 21, 2018.
","Gronik says Wisconsin is ""guaranteeing Foxconn almost $3 billion, but Foxconn is not contractually guaranteeing how many full-time employees it will hire, for how long and at what pay."" Wisconsin is guaranteeing to pay Foxconn up to $2.85 billion -- but the full amount would be paid only if the company invests at least $9 billion in its plant and, in rough numbers, employs at least 13,000 people earning at least $30,000 per year. The payments would be less, if Foxconn doesn’t meet those targets. It’s true that Foxconn is not guaranteeing how many people it will hire, for how long and at what pay. That means it’s theoretically possible the company could earn up to $1.35 billion in investment incentives but not employ anyone, if it built the facility but never operated it. But the other $1.5 billion would be paid, on a graduated basis, only as people are employed at the plant. ",Tom Kertscher,https://www.politifact.com/factchecks/2017/sep/12/andy-gronik/wisconsin-guaranteeing-nearly-3-billion-foxconn-no/,half-true
Scott Walker,"Says Foxconn didn't keep a promise to build a plant in Pennsylvania because ""Pennsylvania changed governors.""
 ","Scott Walker, a Republican, is the former governor of Wisconsin. He was first elected in November 2010. He survived a recall election in 2012, defeating Milwaukee Mayor Tom Barrett after igniting controversy with a bill curtailing public-employee union collective-bargaining rights.  He won re-election to a four-year term in November 2014 and was a 2016 presidential candidate before dropping out in September of 2015. He was defeated by Tony Evers in the 2018 gubernatorial election. Walker is a former Milwaukee County executive and former member of the state Assembly.","Walker says Foxconn didn't keep a promise to build a plant in Pennsylvania because ""Pennsylvania changed governors."" But the record indicates that by the time the Democratic administration took over, little progress had been made more than a year after Foxconn and the GOP governor announced Foxconn’s plans. It's not as though there was a deal in place that fell apart after the election. Foxconn, meanwhile, has given explanations ranging from ""material changes to the business and operating climate at that time,"" to Pennsylvania not making an economically viable to proposal to, reportedly, blaming Pennsylvania’s change in governors. ",Tom Kertscher,https://www.politifact.com/factchecks/2017/aug/25/scott-walker/scott-walker-says-pennsylvania-lost-foxconn-plant-/,barely-true
Jennifer  Shilling,"""Foxconn tax break could exceed $1 million per job.""
 ","Jennifer Shilling, a Democrat from La Crosse in western Wisconsin, was elected to the Wisconsin Assembly in 2000 and served there until winning election to the state Senate in 2011. Democrats elected her as their Senate leader in 2014.
","Shilling said about a $3 billion incentive package being offered by the State of Wisconsin: ""Foxconn tax break could exceed $1 million per job."" We found in a previous fact check that the state would not be paying Foxconn $3 billion for 3,000 jobs -- or $1 million per job -- because the full $3 billion would be paid only if 13,000 jobs are created. In Shilling’s favor, if Foxconn invests at least $9 billion in its plant as it has said it will -- but hires only 1,500 workers -- the incentives paid would exceed $1 million per job. That being said, while there is not yet a commitment that Foxconn will create a minimum number of jobs, there is also no evidence that the total would be only 1,500 jobs if it invests $9 billion in its plant.   ",Tom Kertscher,https://www.politifact.com/factchecks/2017/aug/16/jennifer-shilling/wisconsin-paying-foxconn-1-million-job-possible-if/,half-true
Donald Trump,"Untaxed corporate earnings used to be ""$2.5 trillion … I guess it’s $5 trillion now. Whatever it is, it’s a lot more. So we have anywhere from 4 (trillion) to 5 or even more trillions of dollars sitting offshore.""","Donald Trump is the former president of the United States. He was elected the 45th president of the United States on Nov. 8, 2016.  He has been a real estate developer, entrepreneur and host of the NBC reality show, ""The Apprentice."" Trump's statements were awarded PolitiFact's 2015, 2017 and 2019 Lie of the Year. In November 2022, he announced he would run for president in 2024.","Trump described untaxed corporate earnings in overseas accounts as growing monumentally, from around $2.5 trillion to ""anywhere from 4 (trillion) to 5 or even more trillions of dollars sitting offshore."" The highest reported number of offshore earnings is $2.8 trillion. That could be off by a couple hundred billion dollars due to undisclosed untaxed earnings. But experts agreed the discrepancy could not add up to Trump’s $4 trillion or $5 trillion estimate. Business optimism and altered definitions of untaxed revenue couldn’t bridge that gap either. ",Manuela Tobias,https://www.politifact.com/factchecks/2017/aug/03/donald-trump/are-there-over-4-trillion-untaxed-corporate-earnin/,false
Donald Trump,"Amazon has a ""no-tax monopoly.""","Donald Trump is the former president of the United States. He was elected the 45th president of the United States on Nov. 8, 2016.  He has been a real estate developer, entrepreneur and host of the NBC reality show, ""The Apprentice."" Trump's statements were awarded PolitiFact's 2015, 2017 and 2019 Lie of the Year. In November 2022, he announced he would run for president in 2024.","Trump said Amazon has a ""no-tax monopoly."" Amazon is an industry giant, but it does not exert enough market control to be considered a monopoly, and no U.S. tribunal has ever deemed it as such. While Amazon takes advantage of tax breaks and loopholes, it pays federal corporate tax, and charges sales taxes in 46 U.S. jurisdictions. It also supports federal legislation that would require other online retailers to pay state tax on internet sales. ",John Kruzel,https://www.politifact.com/factchecks/2017/jul/26/donald-trump/amazon-no-tax-monopoly-donald-trump-said/,pants-fire
Paul Ryan,"A report from the nonpartisan Congressional Budget Office ""confirms that the American Health Care Act will lower premiums.""","U.S. Rep. Paul Ryan, R.-Wis., became Speaker of the House in 2015 and served until his retirement in January 2019. Ryan was elected to represent southern Wisconsin in Congress in 1998 and for part of his tenure chaired the House Budget Committee. He was Mitt Romney's vice-presidential running mate in the 2012 presidential election. He did not seek re-election in 2018.","Ryan says a report from the nonpartisan Congressional Budget Office ""confirms that the American Health Care Act will lower premiums."" His reference is to people who buy health insurance on their own, rather than getting it from an employer or a government program such as Medicaid -- and how the Republicans’ American Health Care Act compares to the existing Affordable Care Act. For those people, the report expects average premiums would be 15 percent to 20 percent higher in 2018 and 2019, but by 2026 would be 10 percent lower. And the report also says that out-of-pocket expenses, such as deductibles, would tend to be higher than under Obamacare. ",Tom Kertscher,https://www.politifact.com/factchecks/2017/mar/14/paul-ryan/paul-ryans-partially-accurate-claim-republican-rep/,half-true
Tammy Baldwin,"""‘TrumpCare’ would allow insurance execs to personally make millions off your health care.""","Tammy Baldwin was elected to the U.S. Senate on Nov. 6, 2012. She represented Wisconsin’s Second Congressional District from January 1999 to January 2013. She served as a member of the Wisconsin Assembly from January 1993 to January 1999. She was a Dane County supervisor from 1986 to 1994 and briefly served on the Madison Common Council, filling a vacancy, in 1986.","Baldwin says ""‘Trumpcare’ would allow insurance execs to personally make millions off your health care."" One provision in a Trump-supported Republican bill to replace Obamacare is a tax break worth an estimated $400 million over 10 years. It’s possible that money could fund raises for health care company executives. But the tax break is for the companies, not individuals; the companies could use the savings for other purposes; and even if the savings were used for raises, there’s no evidence that executives would get millions. ",Tom Kertscher,https://www.politifact.com/factchecks/2017/mar/13/tammy-baldwin/would-trumpcare-gop-replacement-obamacare-allow-in/,barely-true
