Donald Trump,“The Obama administration made a decision on testing that turned out to be very detrimental to what we’re doing” on the coronavirus.,"Donald Trump is the former president of the United States. He was elected the 45th president of the United States on Nov. 8, 2016.  He has been a real estate developer, entrepreneur and host of the NBC reality show, ""The Apprentice."" Trump's statements were awarded PolitiFact's 2015, 2017 and 2019 Lie of the Year. In November 2022, he announced he would run for president in 2024.","Trump said the Obama administration made a decision that ""turned out to be very bad"" for detecting the COVID-19 virus. The White House pointed to a new FDA policy that made it easier for labs to use their own methods to detect the COVID-19 virus. But the FDA never had firm legal authority over those labs.  The new policy still asks labs to apply for Emergency Use Authorization. The shift is that once they apply, they can get to work before getting the nod from the FDA. The policy that had been in place had its roots in guidance that dates to at least 2007, and before that, to a 2004 law, before Obama took office. ",Jon Greenberg,https://www.politifact.com/factchecks/2020/mar/06/donald-trump/trump-wrongly-blames-obama-limits-coronavirus-test/,false
Lou Dobbs,"The United States is “actually screening fewer people (for the coronavirus than other countries) because we don't have appropriate testing.""","Lou Dobbs is a television host on Fox Business Network. He was formerly the host of CNN’s ‘Lou Dobbs Tonight’.
","Dobbs said that the United States is ""actually screening fewer people (for the coronavirus than other countries) because we don’t have appropriate testing."" Experts told us that to date, the United States has lagged behind other countries, though numbers are imprecise. An error with the CDC’s early test kits contributed to the United States’ relatively low screening numbers. The administration has taken steps to make testing more widely available. ",Bill McCarthy,https://www.politifact.com/factchecks/2020/mar/04/lou-dobbs/lou-dobbs-says-united-states-screening-fewer-peopl/,mostly-true
Facebook posts,"“The blood test for coronavirus costs $3,200.”","Posters on Facebook and other social media networks.
 ","The Facebook post says the ""blood test for coronavirus costs $3,200."" Testing for COVID-19 is free. But there could be costs associated with seeking such testing, like a visit to the hospital. In one case, in Florida, a man who worried he was infected initially faced a $3,270 bill even though he never received a coronavirus test.  ",Ciara O'Rourke,https://www.politifact.com/factchecks/2020/mar/04/facebook-posts/coronavirus-testing-free-there-could-be-other-cost/,barely-true
Facebook posts,Says President Barack Obama “waited six months to call swine flu an emergency after thousands died.”,"Posters on Facebook and other social media networks.
 ","The headline of an article shared on Facebook claimed: ""Obama waited six months to call swine flu an emergency after thousands died."" In October 2009, after more than 1,000 people in the United States had died of swine flu, also known as H1N1, Obama declared a national emergency. But six months earlier, his administration declared H1N1 a public health emergency. At that point, no deaths in the United States had occurred.  ",Tom Kertscher,https://www.politifact.com/factchecks/2020/mar/04/facebook-posts/president-obama-declared-h1n1-public-health-emerge/,false
Facebook posts,"“The coronavirus has made it to Mississippi and the lady that caught it wasn’t around nobody with it which means it is airborne. That means if the wind blows it your direction you’ll have it also.”
","Posters on Facebook and other social media networks.
 ","The Facebook post says a woman in Mississippi was infected by the coronavirus and that it was airborne.  We’re still learning about the coronavirus and how it spreads, but this isn’t accurate.  Currently, there are no confirmed cases in Mississippi, and while it has been suggested that coronavirus could be airborne, it hasn’t been documented to spread that way. Rather, the virus’s spread has been documented via respiratory droplets mainly when an infected person coughs or sneezes.  ",Ciara O'Rourke,https://www.politifact.com/factchecks/2020/mar/03/facebook-posts/there-are-no-confirmed-coronavirus-cases-mississip/,false
Facebook posts,"”America has been vaccinating cattle for coronavirus for years, yet the news tells you it’s new and gunna kill you all so go buy mask.”","Posters on Facebook and other social media networks.
 ","A Facebook post claims: ""America has been vaccinating cattle for coronavirus for years, yet the news tells you it’s new and gunna kill you all so go buy mask."" Despite what the post suggests, the existence of a bovine vaccine doesn’t mean there is a coronavirus vaccine for humans, and none is expected soon. ",Tom Kertscher,https://www.politifact.com/factchecks/2020/mar/02/facebook-posts/bovine-coronavirus-vaccine-wont-help-humans/,false
Facebook posts,"""Poll Finds 38% of Americans Say They Will Not Drink Corona Beer Because of Virus.""","Posters on Facebook and other social media networks.
 ","A statement shared on Facebook said: ""Poll Finds 38% of Americans Say They Will Not Drink Corona Beer Because of Virus."" The poll was of American beer drinkers, not Americans overall. Other details of this ""poll"" — including the specific question asked — are unknown, so it’s difficult to say beer drinkers wouldn’t drink Corona beer because of the virus, or some other reason. ",Tom Kertscher,https://www.politifact.com/factchecks/2020/mar/02/facebook-posts/no-poll-does-not-say-38-americans-wont-drink-coron/,false
Chad Wolf,The mortality rate for the flu is “right around” that of the new coronavirus: “It’s right around 2%.”,"On November 13, 2019, Chad F. Wolf was designated as the Acting Secretary of Homeland Security by President Donald J. Trump and was also confirmed as the first Under Secretary of the U.S. Department of Homeland Security’s (DHS) Office of Strategy, Policy, and Plans (PLCY). Previously, he served as the Acting Under Secretary.  ","There are two ways to parse out this claim: First, is it true that the average U.S. mortality rate for flu is 2%?  That’s not true, according to data from the CDC and exchanges with multiple global health experts. On average, the flu mortality rate during the past 10 years has been 0.1%. In addition, Wolf and a DHS spokesperson admitted that the acting secretary did not have the statistics in front of him when he answered questions at the hearing about the mortality rates.  Second, is it true the COVID-19 mortality rate is similar to the flu mortality rate?  Wolf is also wrong on that account, based on the limited information currently known about the coronavirus. Recent data from the Chinese government set the COVID-19 mortality rate at 2.3%. That’s vastly different from the flu’s mortality rate of 0.1%.  Experts also said that while it’s possible the mortality rate from the new virus could come close to the flu’s mortality rate eventually ― if the case definition of coronavirus is expanded -- it’s too soon to make that assumption with the limited information available.  ",Victoria Knight,https://www.politifact.com/factchecks/2020/mar/02/chad-wolf/n-exchange-about-coronavirus-homeland-security-chi/,false
Facebook posts,Says the coronavirus can be slowed or stopped with the “immediate widespread use of high doses of vitamin C.”,"Posters on Facebook and other social media networks.
 ",A Facebook post says that taking high doses of vitamin C will slow or even stop the coronavirus.  There’s no evidence that the supplement has any effect on the coronavirus. There is currently no vaccine or medicine recommended for the virus.  ,Samantha Putterman,https://www.politifact.com/factchecks/2020/feb/29/facebook-posts/no-vitamin-c-cannot-slow-or-stop-spread-coronaviru/,false
Charlie Kirk,“Three Chinese nationals were apprehended trying to cross our Southern border illegally. Each had flu-like symptoms. Border Patrol quickly quarantined them and assessed any threat of coronavirus.”,"Charlie Kirk is the founder and president of Turning Point USA, a conservative group that advocates for limited government and free markets.","Kirk said: ""Three Chinese nationals were apprehended trying to cross our Southern border illegally. Each had flu-like symptoms. Border Patrol quickly quarantined them and assessed any threat of Coronavirus."" On Feb. 10, three people from China were apprehended at the border and two had a fever. All three were taken to a local hospital for assessment and were medically cleared for travel. None of the individuals were quarantined at the station. Kirk’s tweet gets some things right, but includes inaccurate details, like the number of people with symptoms and whether individuals were quarantined. He also leaves out the conclusion of this saga: None of the people had coronavirus. ",Madlin Mekelburg,https://www.politifact.com/factchecks/2020/feb/28/charlie-kirk/checking-tweet-about-chinese-people-detained-flu-s/,mostly-true
Michael Bloomberg,"Says of President Donald Trump’s actions on the coronavirus: “No. 1, he fired the pandemic team two years ago. No. 2, he's been defunding the Centers for Disease Control.”","Michael Bloomberg was mayor of New York City from 2002 to 2013. The billionaire co-founded Bloomberg LP, a financial information and media company, in 1981. On Nov. 24, 2019, he announced his candidacy for the 2020 Democratic nomination for president and dropped out on March 4, 2020.","Bloomberg said Trump is hampered in the fight against coronavirus because ""No. 1, he fired the pandemic team two years ago. No. 2, he's been defunding Centers for Disease Control."" On the first point, it’s hard to pin down whether the National Security Council staffers were ""fired"" in 2018, but they certainly left abruptly and have not been replaced, though other leaders in the coronavirus fight have been named in recent days. On the second point — funding — there’s no question that the Trump administration sought to cut key CDC budget categories that would be involved in emerging infections like coronavirus. But Bloomberg overlooks that, thanks to Congress, that funding was restored and even increased in bills that were ultimately signed by Trump. ",Louis Jacobson,https://www.politifact.com/factchecks/2020/feb/28/michael-bloomberg/did-donald-trump-fire-pandemic-officials-defund-cd/,half-true
Facebook posts,Says the CDC recommends men shave their beards to protect against coronavirus.,"Posters on Facebook and other social media networks.
 ","A headline claims that the CDC recommends men shave their beards to protect against coronavirus. The story, and others like it, say that facial hair can interfere with masks – and that isn’t untrue – but these posts in connection with the coronavirus are ultimately misleading.  The story inaccurately says the CDC is telling people to shave their faces to help ward off the coronavirus and omits that the graphic was made years ago and unrelated to the current outbreak. It also misses health officials’ actual recommendation against using respirators for protection outside of the workplace.  ",Samantha Putterman,https://www.politifact.com/factchecks/2020/feb/27/facebook-posts/no-cdc-isnt-recommending-men-shave-their-beard-pro/,false
Rush Limbaugh,"“The coronavirus is the common cold, folks.”","Rush Limbaugh is a conservative radio talk show host. His website describes him as ""America's Truth Detector; the Doctor of Democracy; the Most Dangerous Man in America; the All-Knowing, All-Sensing, All-Everything Maha Rushie; defender of motherhood, protector of fatherhood and an all-around good guy.""","Limbaugh said the 2019 coronavirus is ""the common cold."" Generally speaking, coronaviruses are a family of viruses that produce illnesses ranging from the common cold to more critical diseases such as SARS or MERS.  But the 2019 coronavirus is a novel strain that was unknown before December. It is different and can be much more dangerous than the common cold. ",Bill McCarthy,https://www.politifact.com/factchecks/2020/feb/27/rush-limbaugh/fact-checking-rush-limbaughs-misleading-claim-new-/,false
Facebook posts,“If you have the Flu… get these two items… Sambucol (and) Oscillococcinum… in 48 hours you will feel better. In 72 hours you will be almost symptom-free.”,"Posters on Facebook and other social media networks.
 ","A post claims, ""If you have the Flu… get these two items… Sambucol [and] Oscillococcinum… in 48 hours you will feel better. In 72 hours you will be almost symptom-free."" Overall, Sambucol has the most flu-fighting potential, but there is little evidence that Oscillococcinum can considerably shorten the length of the flu. And there isn’t enough evidence to prove that either of them can treat influenza better than antiviral medications.  ",Emily Venezky,https://www.politifact.com/factchecks/2020/feb/27/facebook-posts/homeopathic-supplements-are-not-proven-treat-flu/,barely-true
Facebook posts,“Breaking: UK Prepares For Full Lockdown After Hundreds Of New Cases — Wuhan Super Virus Updates.”,"Posters on Facebook and other social media networks.
 ","A Facebook post says: ""Breaking: UK Prepares For Full Lockdown After Hundreds Of New Cases — Wuhan Super Virus Updates."" There are fewer than 10 coronavirus cases in the United Kingdom and no signs that travel or other aspects of life in Britain have been shut down by the virus. ",Tom Kertscher,https://www.politifact.com/factchecks/2020/feb/25/facebook-posts/no-evidence-united-kingdom-preparing-lockdown-over/,false
Hal Turner Radio Show,Says the coronavirus is “a MILITARY BIO-WEAPON Developed by China's Army.”,"Hal Turner uses internet and radio broadcasts to float conspiracy theories and hate speech. In 2010, he was sentenced to 33 months in prison for threatening three federal judges over their decision to uphold handgun bans in Chicago.","The Hal Turner Radio Show claimed the coronavirus is ""a MILITARY BIO-WEAPON Developed by China's Army."" As evidence, the website included two screenshots of coronavirus entries in a federal database of genetic material. The site claimed the two viruses are the same. But all human coronaviruses have similar genetic material, and just because the entries were uploaded by Chinese researchers doesn’t prove that the 2019 coronavirus was developed as a bioweapon. ",Daniel Funke,https://www.politifact.com/factchecks/2020/feb/11/hal-turner-radio-show/far-right-radio-host-hal-turner-promotes-unproven-/,false
Facebook posts,Event 201 “gave out stuffed souvenir coronavirus toys” to “commemorate” Novel coronavirus outbreak,"Posters on Facebook and other social media networks.
 ","A Facebook post says that Event 201 in October 2019 gave out stuffed coronavirus plushies to commemorate a coronavirus outbreak that didn’t start until December 2019. Yes, these plushies are meant to represent coronavirus microbes. They were given out in October — two months before the first cases of the current 2019 coronavirus outbreak appeared — but this was not because the event’s organizers had predicted the Novel Coronavirus to come. They were distributed as part of the registration for a New York event that was centered on preparing for a new coronavirus pandemic because of the history of outbreaks. These plushies were not intended to commemorate the toll that outbreak would bring. ",Emily Venezky,https://www.politifact.com/factchecks/2020/feb/03/facebook-posts/these-plushies-do-not-commemorate-2019-novel-coron/,barely-true
Tweets,Says drinking a bleach solution will prevent you from getting the coronavirus.,"
Twitter is a messaging service where people often discuss politics. Individual messages are called Tweets.
","Backers of the QAnon conspiracy are recommending drinking a bleach solution to ward off the deadly 2019 Novel coronavirus. While the MMS solution has been touted by fringe groups as a ""miracle cure"" for a number of ailments, officials have repeatedly warned consumers against ingesting it, saying that doing so could cause severe vomiting, diarrhea and acute liver failure. ",Samantha Putterman,https://www.politifact.com/factchecks/2020/jan/30/tweets/no-drinking-bleach-will-not-ward-coronavirus/,pants-fire
Facebook posts,"Says a ""Clorox bottle claimed it could kill (the 2019 coronavirus)... before it was developed.""","Posters on Facebook and other social media networks.
 ","A Facebook post claims a ""Clorox bottle claimed it could kill (the 2019 coronavirus)... before it was developed."" It’s true that some Clorox products have labels that claim they’re effective against human coronaviruses. But that’s because they were proven effective against past strains of coronavirus — not the one currently spreading from China. There is no evidence that the 2019 coronavirus was ""developed"" prior to the outbreak. ",Daniel Funke,https://www.politifact.com/factchecks/2020/jan/30/facebook-posts/clorox-bottles-dont-prove-coronavirus-was-develope/,false
Facebook posts,"""CORONAVIRUS: Reports of 10,000 DEAD in Wuhan, China.""","Posters on Facebook and other social media networks.
 ","A claim circulating on Facebook says: ""CORONAVIRUS: Reports of 10,000 DEAD in Wuhan, China."" There is nothing but mostly anonymous hearsay to back it up. Credible news and university reports put the death toll at a tiny fraction of what is claimed — 106 as of the evening of Jan. 27. ",Tom Kertscher,https://www.politifact.com/factchecks/2020/jan/28/facebook-posts/claim-reports-10000-dead-wuhan-coronavirus-pants-f/,pants-fire
Bloggers,"Says China ""stole Coronavirus from Canada and weaponized it into a Bioweapon.""",Blog posting on the Internet,"A Zero Hedge story claims that Chinese agents stole coronavirus samples from Canada to create a biological weapon, which has now caused an outbreak of the disease around the world. A Chinese scientist who worked in a Canadian lab studying coronaviruses is under investigation for trips she took to Wuhan. But there’s no evidence she gave China coronavirus samples to develop a biological weapon. Plus, the lab worked on MERS, not the Wuhan coronavirus. The Wuhan lab mentioned in the story does deal with dangerous pathogens like coronaviruses, but there is no evidence that it is the source of the latest outbreak. ",Daniel Funke,https://www.politifact.com/factchecks/2020/jan/28/blog-posting/websites-spin-conspiracy-theory-about-coronavirus-/,false
Facebook posts,"Says a coronavirus patent expired just as there is a ""sudden outbreak"" and, despite ""media fear-mongering,"" there is already a vaccine available.","Posters on Facebook and other social media networks.
 ","A Facebook post states: ""So.. patent on this ‘new’ Corona virus expired on the 22nd, today.. We have a sudden outbreak. There's magically already a vaccine available.. And NOW fear mongering spread by the media about quarantine."" There was an outbreak in recent weeks of what is known as the Wuhan coronavirus.  News media reported that Chinese authorities have taken steps to quarantine Wuhan, the city in China where the outbreak was discovered. More importantly, there was no expired patent related to the Wuhan coronavirus, and there is currently no vaccine for the Wuhan coronavirus, either. ",Tom Kertscher,https://www.politifact.com/factchecks/2020/jan/23/facebook-posts/there-outbreak-china-wuhan-coronavirus-there-not-v/,pants-fire
Bernie Sanders,"In the first three quarters of 2022, “the railroad industry made $21 billion in profits, provided $25 billion in stock buybacks and dividends” and CEOs are paid up to $20 million a year, while railroad workers have ""zero guaranteed sick leave.""","Bernie Sanders is a senator from Vermont. Sanders was first elected to the Senate in 2007 and was re-elected in 2012 and 2018. The senator also ran an unsuccessful presidential campaign in 2016, losing the Democratic primary to Hillary Clinton. From 1991 until 2007, he was the representative of Vermont’s At-Large District of the House of Representatives. Sanders was the mayor of Burlington from 1981 to 1989. He received a bachelor’s degree in political science from the University of Chicago. In 2019, he announced he was running for the Democratic nomination for president and dropped out in April 2020.","Sanders said that in the first three quarters of 2022, ""the railroad industry made $21 billion in profits, provided $25 billion in stock buybacks and dividends,"" and that CEOs are paid up to $20 million a year, while railroad workers have ""zero guaranteed sick leave."" The dollar figures he cited are correct for the seven major rail carriers in the U.S.  Sanders is mostly correct on paid sick days. The vast majority of workers at the largest railroads have none, but a small percentage do. The statement is accurate but needs clarification or additional information. ",Tom Kertscher,https://www.politifact.com/factchecks/2022/dec/08/bernie-sanders/bernie-sanders-correct-railroads-net-billions-vast/,mostly-true
Charlie Crist,"Gov. Ron DeSantis raised ""taxes on the middle class by more than $1.5 billion while giving away $624 million to big corporations.""","Charlie Crist lost the race for Florida governor as the Democratic candidate in 2022. He served as a U.S. congressman from St. Petersburg since 2017 and resigned Aug. 31, 2022 to focus on his campaign.  As a Republican, Crist served as governor from 2007 to 2011. Crist left the Republican Party in 2010 to mount a campaign for the U.S. Senate as an independent. Crist lost the race to Marco Rubio. In 2012, he endorsed President Barack Obama and announced that he had registered as a Democrat. He lost his race as a Democratic candidate for governor in 2014.","Crist said DeSantis raised ""taxes on the middle class by more than $1.5 billion"" and gave $624 million to ""big corporations."" That's misleading. Although DeSantis signed legislation to revise Florida's online sale tax — which the state estimated would generate around $1 billion annually — the law neither established a new tax nor targeted only the middle class.  Crist had more of a point when considering the amount of money Florida refunded to large corporations. The Florida Department of Revenue told PolitiFact it refunded nearly $624 million to the state's corporate taxpayers this year.  In 2019, DeSantis signed legislation that extended a provision — signed by former Gov. Rick Scott — that temporarily reduced corporate income tax rates. The refunds benefited more than 20,000 corporate taxpayers, according to the state Department of Revenue.  ",Yacob Reyes,https://www.politifact.com/factchecks/2022/sep/02/charlie-crist/charlie-crist-misleads-ron-desantis-record-taxes/,barely-true
Abigail Spanberger,“The four big meat packers are raking in record profits … ”,"Abigail Spanberger is the 2018 Democratic nominee for the 7th Congressional seat in Virginia. A former CIA agent, she is challenging incumbent Republican Dave Brat
","Spanberger wrote, ""The four big meat packers are raking in record profits."" ",Warren Fiske,https://www.politifact.com/factchecks/2022/jun/30/abigail-spanberger/big-four-meat-packers-are-seeing-record-profits-sp/,true
Erica Smith,"“Corporate profit margins are at their highest point in 70 years. … They’re overcharging us for gas, medicine, and groceries, and pocketing the difference.”",Erica Smith is an NC state Senator who's running for US Senate.,"Smith said ""Corporate profit margins are at their highest point in 70 years … they're overcharging us for gas, medicine, and groceries, and pocketing the difference."" Government data show that Smith is right about the profit margins of companies in the U.S., collectively speaking. Consumers in the U.S. tend to pay more for medicine than consumers in other countries. Oil companies are also making more money lately. However, economists say it’s misleading for Smith to suggest that your neighborhood grocery store or gas station is running what she described as ""a racket."" ",Paul Specht,https://www.politifact.com/factchecks/2022/jan/07/erica-smith/smith-says-corporate-profits-hit-record-high-blame/,half-true
Democratic Underground,“The second-largest investor in Regeneron” is a firm whose CEO is Ron DeSantis’ “number one political donor.”,"Democratic Underground describes itself as ""an online community where politically liberal people can do their part to effect political and social change.""
 ","Democratic Underground claimed that ""the second-largest investor in Regeneron"" is a firm whose CEO is DeSantis’ ""number one political donor."" Citadel’s CEO is a major donor to the Florida governor’s political action committee, and his firm has investments in Regeneron, a company that makes a drug product for treating COVID-19. But it is far from being the second-largest investor in Regeneron. ",Tom Kertscher,https://www.politifact.com/factchecks/2021/aug/19/democratic-underground/firm-led-top-donor-fla-gov-ron-desantis-donor-isnt/,barely-true
