Tammy Baldwin,"Says Secretary of State Rex Tillerson got a ""government service golden parachute"" payment of $180 million ""from Exxon Mobil that he would have to forfeit had he taken a job elsewhere.""  
 ","Tammy Baldwin was elected to the U.S. Senate on Nov. 6, 2012. She represented Wisconsin’s Second Congressional District from January 1999 to January 2013. She served as a member of the Wisconsin Assembly from January 1993 to January 1999. She was a Dane County supervisor from 1986 to 1994 and briefly served on the Madison Common Council, filling a vacancy, in 1986.","Baldwin says Tillerson got a ""government service golden parachute"" payment of $180 million ""from Exxon Mobil that he would have to forfeit had he taken a job elsewhere.""   The amount is correct and the company did opt to ""cash out"" Tillerson because he would be becoming secretary of state. But on Baldwin's larger point, it’s an earned retirement benefit, not newly added compensation and not something created simply because Tillerson took a government post. He would almost certainly have been in line to receive it even if he had taken a different job, as long as it wasn’t with an Exxon Mobil competitor. ",Tom Kertscher,https://www.politifact.com/factchecks/2017/feb/10/tammy-baldwin/secretary-state-rex-tillersons-180-million-exxon-g/,barely-true
Aaron DeGroot,"Says Kate Cloonen ""needs that extra $68,000"" lawmaker salary on top of the ""$8.5 million in state contracts for her construction company.""","Aaron DeGroot has served as the Illinois Republican Party downstate press secretary since April 2016. 
","On Dec. 2, Illinois Republican Party’s Downstate Press Secretary Aaron DeGroot tweeted: ""For Kate Cloonen, $8.5 million in state contracts for her construction company isn't enough. She needs that extra $68k/year"" According to a document verified by IDOT, Cloonen’s company received $8.5 million in state construction funding for projects during her time as a legislator. Cloonen said that number is not an accurate reflection of what she personally netted from the state construction work, but she declined to share that amount. DeGroot’s tweet, though, lacks context and tries to draw a comparison between an individual salary and a company’s gross payment, not net profit, for work completed. Cloonen’s construction company only acted as a subcontractor and never directly bid on any state projects. Cloonen never was found to have a conflict of interest, and she recused herself from most votes regarding capital projects. And while political science professor emeritus Kent Redfield said Cloonen may have a conflict of interest being both a lawmaker and a business owner, he also said she operated within the law and did not act unethically. Though DeGroot’s comment about Cloonen was accurate, it omits significant information, including the fact that Cloonen was a subcontractor not hired directly by the state and regularly recuses herself from voting on capital problems. ",Marc Filippino,https://www.politifact.com/factchecks/2017/jan/06/aaron-degroot/illinois-gop-press-secretary-makes-8-million-twitt/,half-true
Mark Pocan,"Says Donald Trump's first 17 Cabinet appointments ""have a net worth of more than a third of America.""","Mark Pocan was elected to the U.S. House of Representatives in the 2nd Congressional District on Nov. 6, 2012. He is from Madison and previously served as a Democratic member of the Wisconsin state Assembly. ","Pocan says Trump's first 17 Cabinet appointments ""have a net worth of more than a third of America."" One-third of American households have a combined net worth of roughly zero. So, the combined net worth of Trump Cabinet members is greater, but so is that of any American who has a net worth of more than zero.   https://www.sharethefacts.co/share/8a023f85-18f0-46c6-afaf-51178c79b199 Recent fact checks on wealth ",Tom Kertscher,https://www.politifact.com/factchecks/2016/dec/30/mark-pocan/do-17-picks-donald-trumps-cabinet-have-higher-net-/,mostly-true
Donald Trump,"America’s federal business tax rate is the highest ""in the world.""","Donald Trump is the former president of the United States. He was elected the 45th president of the United States on Nov. 8, 2016.  He has been a real estate developer, entrepreneur and host of the NBC reality show, ""The Apprentice."" Trump's statements were awarded PolitiFact's 2015, 2017 and 2019 Lie of the Year. In November 2022, he announced he would run for president in 2024.","Trump said America’s federal business tax rate is the highest ""in the world."" The top corporate tax in the United States is 35 percent, highest among the world’s industrialized nations. But five smaller nations have the same rate and two smaller ones, United Arab Emirates and Puerto Rico, have rates above 35 percent. Also, the 35 percent U.S. rate is only the starting point, given that corporations can use exemptions and deductions to effectively reduce that rate and pay lower taxes. ",Tom Kertscher,https://www.politifact.com/factchecks/2016/dec/15/donald-trump/pledging-cuts-donald-trump-says-wisconsin-rally-us/,mostly-true
Food & Water Watch,"Says Rex Tillerson ""sued to keep a fracking project out of his backyard.""","Food & Water Watch is a consumer rights and environmental group based in Washington, D.C.
","Food & Water Watch said Tillerson ""sued to keep a fracking project out of his backyard."" Tillerson joined a lawsuit that listed noise nuisance and traffic hazards among the plaintiffs’ many concerns, though he later dropped out of the litigation. ",Linda Qiu,https://www.politifact.com/factchecks/2016/dec/14/watch-food-water/did-rex-tillerson-oil-ceo-and-secretary-state-pick/,mostly-true
Deborah Ross,"""Richard Burr voted to protect tax breaks for companies that ship jobs overseas but voted against a tax break to help working people.""","Deborah Ross is a Democratic politician from North Carolina. She is a lawyer, former state representative and former head of the North Carolina ACLU.
","Ross said that Burr ""voted to protect tax breaks for companies that ship jobs overseas but voted against a tax break to help working people."" PolitiFact has docked points on several versions of this same claim in the past, in large part because it oversimplifies the bills in question and doesn’t account for the fact that experts don’t think the bills would have done anything to keep jobs in the United States, or bring them back, had the changes become law. Burr did vote against the bills in question – inconsequential though they might have been – so there is a sliver of truth here. But the reality of the situation isn’t nearly so cut-and-dried as Ross describes it. ",Will Doran,https://www.politifact.com/factchecks/2016/nov/02/deborah-ross/did-richard-burr-vote-protect-tax-breaks-companies/,half-true
John Skvarla,"Says HB2 ""hasn’t moved the needle one iota"" on North Carolina’s economy.","John Skvarla is a Republican political appointee and N.C. Secretary of Commerce
","North Carolina has undeniably lost money and jobs due to HB2, so Skvarla’s claim that the law ""hasn’t moved the needle one iota"" on the economy seems incorrect at first glance. On a macro scale, however, Skvarla has a point. Even hundreds of millions of dollars in losses won’t dent the state’s GDP very much. And the now-canceled jobs would not have had much of an impact on the overall unemployment rate. Yet many local economies – particularly in Wake and Mecklenburg counties, the state’s two largest – have felt the sting of hundreds of jobs lost, that would have provided tens of millions of dollars in annual wages. That would have helped the economy. So would the tens of thousands of sports fans who will now spend their money in other states. ",Will Doran,https://www.politifact.com/factchecks/2016/oct/28/john-skvarla/top-north-carolina-economic-official-says-hb2-has-/,barely-true
Donald Trump,"""In her campaign for president, Hillary Clinton has received $100 million in contributions from Wall Street and hedge funds.""","Donald Trump is the former president of the United States. He was elected the 45th president of the United States on Nov. 8, 2016.  He has been a real estate developer, entrepreneur and host of the NBC reality show, ""The Apprentice."" Trump's statements were awarded PolitiFact's 2015, 2017 and 2019 Lie of the Year. In November 2022, he announced he would run for president in 2024.","Campaigning outside Milwaukee, Trump said: ""In her campaign for president,"" Clinton ""has received $100 million in contributions from Wall Street and hedge funds."" The gold-standard source on this subject puts the figure at $64 million. ",Tom Kertscher,https://www.politifact.com/factchecks/2016/oct/06/donald-trump/how-much-money-have-wall-street-and-hedge-funds-gi/,false
Mark Warner,"""The average time someone used to hold a share of stock back in the ’60s was eight years. Now, the average time is four months."" ","Mark Warner, a Democrat, has represented Virginia in the U.S. Senate since 2009. He serves on the Banking, Budget, Commerce and Intelligence committees. He is the honorary co-chairman of the Forward Together PAC.
Warner gave the keynote address at the 2008 Democratic National Convention. Warner previously served as governor of Virginia from 2002 to 2006. He also ran unsuccessfully for the U.S. Senate in 1996. Before public office, Warner was an early investor in the cell phone business, co-founded the company that became Nextel.
Warner was born in Indianapolis, Ind., and grew up in Illinois and Connecticut. Warner graduated from George Washington University, Washington, D.C. He received a law degree from Harvard Law School, Cambridge, Mass.
","Warner said, ""The average time someone used to hold a share of stock back in the ’60s was eight years. Now, the average time is four months.""   The gist of Warner’s statement is undeniable: The average holding period for stocks has eroded greatly during the past 56 years. The specifics of Warner’s statement, however, need a little elaboration. Estimates by Credit Suisse jibe with Warner’s claim that shares, on average, now are held for four months. The World Bank estimates the holding period now is about eight months. ",Warren Fiske,https://www.politifact.com/factchecks/2016/jul/06/mark-warner/mark-warner-says-average-holding-time-stocks-has-f/,mostly-true
Russ  Feingold,"Says Ron Johnson referred to ""The Lego Movie"" as an ""insidious anti-business conspiracy.""","Russ Feingold served as a Democratic U.S. Senator representing Wisconsin from 1992 until 2010, when he was defeated for re-election. An attorney, he previously served 10 years in the Wisconsin Legislature. Following his Senate defeat, he founded Progressives United, which says it mission is to ""stand up to the exploding corporate influence in our political system by organizing and amplifying the voices of those who believe that corporations have too much power."" Feingold is running against U.S. Sen. Ron Johnson, the man who defeated him, in the 2016 election.
","Feingold told a hall full of Democrats that his opponent called ""The Lego Movie"" an ""insidious, anti-business conspiracy."" Johnson used the word ""insidious"" to describe the movie on multiple occasions and repeatedly referred to it as anti-business, though not in so many words. But Feingold is wrong on the boldest and most significant part of the claim. A conspiracy implies a specific fact – that some great hidden hand or collusion is at work to indoctrinate the masses. And it’s something Johnson never said. ",Eric Litke,https://www.politifact.com/factchecks/2016/jun/24/russ-feingold/did-ron-johnson-call-lego-movie-anti-business-cons/,half-true
Robin Wright,"Says Apple products are currently ""90 percent conflict-free,"" and ""Intel is 100 percent conflict-free.""",Robin Wright is an actress and activst.,"Wright said Apple products are currently ""90 percent conflict-free,"" and ""Intel is 100 percent conflict-free."" The numbers are off. Intel says 100 percent of is processors are conflict-free, but couldn’t vouch for its other products. Apple reported that 100 percent of its supply chain was participating in audits, but rejected the label. While experts commend both companies for leading the sector in moving away from conflict minerals, they cautioned against labeling anything 100 percent ""conflict-free."" ",Linda Qiu,https://www.politifact.com/factchecks/2016/jun/15/robin-wright-act/did-your-phone-computer-contribute-suffering-congo/,barely-true
Steve Adler,"""The first tweet was sent from Austin.""","Attorney Steve Adler won election as mayor of Austin in December 2014, drawing 67 percent of the vote in a December 2014 runoff. He was sworn in Jan. 6, 2015. He sought re-election in 2018.
","Adler said the first tweet was sent from Austin. That’s not so. Twitter gained momentum during a SXSW conference in Austin, but the first tweet had been sent nearly a year earlier from California, where the company is based. ",W. Gardner Selby,https://www.politifact.com/factchecks/2016/may/20/steve-adler/steve-adler-ridiculously-claims-first-tweet-was-se/,pants-fire
Bernie Sanders,"""The largest U.S. companies would owe $620 billion in U.S. taxes on the cash they store in tax havens.""","Bernie Sanders is a senator from Vermont. Sanders was first elected to the Senate in 2007 and was re-elected in 2012 and 2018. The senator also ran an unsuccessful presidential campaign in 2016, losing the Democratic primary to Hillary Clinton. From 1991 until 2007, he was the representative of Vermont’s At-Large District of the House of Representatives. Sanders was the mayor of Burlington from 1981 to 1989. He received a bachelor’s degree in political science from the University of Chicago. In 2019, he announced he was running for the Democratic nomination for president and dropped out in April 2020.","Sanders said that if American multinational corporations had to pay taxes on the profits they made overseas, they would owe $620 billion. This is at the high end of the estimates we collected. Sanders also described the overseas holdings as cash. According to one expert we reached, a lot of that money might be invested in factories and other hard infrastructure and might not be available for tax collections. ",Jon Greenberg,https://www.politifact.com/factchecks/2016/apr/11/bernie-sanders/sanders-us-multinationals-would-owe-620-billion-ov/,mostly-true
Hillary Clinton,"""We bailed out"" Johnson Controls when ""we saved the auto industry"" and ""now they want to avoid paying taxes.""","Hillary Clinton was the 2016 Democratic nominee for president. She served as U.S. Secretary of State during the first four years of the Obama administration. She is formerly a U.S. senator from New York, first elected in 2000. She was a candidate for president in 2008. She previously served as first lady when her husband, Bill Clinton, served two terms as president. She was born in Chicago in 1947, graduated from Wellesley College and earned a law degree at Yale Law School. She and her husband have one daughter.
","Clinton said ""we bailed out"" Johnson Controls when ""we saved the auto industry"" and ""now they want to avoid paying taxes."" Johnson Controls was not a direct recipient of the 2008-’09 federal bailouts of the auto industry, but it did push for the funds and, as an auto parts supplier, benefited indirectly. On federal taxes, the company has said it will save $150 million per year by moving its headquarters from suburban Milwaukee to Ireland. ",Tom Kertscher,https://www.politifact.com/factchecks/2016/feb/11/hillary-clinton/hillary-clinton-says-johnson-controls-got-federal-/,mostly-true
Marco Rubio,"""Ted Cruz defended a Chinese company that stole an invention from an American inventor.""","Marco Rubio, a U.S. senator from Florida, was a candidate for president of the United States in 2016 and then dropped out and won re-election to the Senate. He was first elected to the Senate in 2010 and took office Jan. 5, 2011. Rubio served in the Florida House of Representatives from 2000 to 2008 and is a former Speaker of the Florida House. He served on the West Miami City Commission from 1998 to 2000. He is from Miami and holds a law degree from the University of Miami.
","Marco Rubio said ""Ted Cruz defended a Chinese company that stole an invention from an American inventor."" Cruz’s firm represented a Chinese firm found liable for stealing blueprints. While other lawyers argued the appeal, Cruz’s name appears as one of the lawyers representing the Shandong Linglong Rubber Co. against an American company. Cruz and his firm were not involved with the original case, just the appeal. ",Jonathan Van Fleet,https://www.politifact.com/factchecks/2016/feb/07/marco-rubio/rubio-attacks-cruz-role-lawsuit-defending-chinese-/,mostly-true
Gina Raimondo,"
""Owen in MA vs. Owen in RI … Advantage:Rhode Island.""","Gina Raimondo served a four-year term as Rhode Island's general treasurer beginning in Jan. 4, 2011 before being elected governor in 2014. She cofounded and served as a general partner of Point Judith Capital. She is a graduate of Yale Law School and a Rhodes Scholar. She is married with two children.
","There are lots of factors, beyond salaries and rental costs, that govern which state is best for GE or best for Owen. ",Mark Reynolds,https://www.politifact.com/factchecks/2016/feb/07/gina-raimondo/advantage-ri-aimed-ge-not-owen/,true
Ed  Gillespie,"""More businesses are closing than opening in Virginia today.""","Ed Gillespie is a Republican strategist who currently runs the firm Ed Gillespie Strategies. He served as counselor to former President George W. Bush. Gillespie has announced he will run for Virginia governor in 2017. He narrowly lost a 2014 bid for the U.S. Senate to Democrat Mark Warner.
","Gillespie says ""more businesses are opening than closing in Virginia today."" A campaign spokesman says Gillespie based his statement on an ODU report, published last November, that contained data through 2011. The report said that ""since 2008, more firms have been dying than have been created, both nationally and regionally."" Census data from 2011 does show a steady four-year decline in the number of Virginia business establishments. But these statistics are stale. The latest figures show the number of businesses began to slowly increase again in 2012 and 2013 -- although they still had not recovered to their pre-recession levels. The bottom line: There’s no evidence that business deaths are exceeding births today. The most current statistics point otherwise, although they hardly suggest a baby boom. ",Warren Fiske,https://www.politifact.com/factchecks/2016/feb/01/ed-gillespie/gillespie-says-more-businesses-are-closing-opening/,false
Martin O'Malley,"""Fifty years ago, the average GM employee could pay for a year of a son or daughter’s college tuition on just two weeks wages.""","Martin O'Malley is the former governor of Maryland who is running for the Democratic nomination for president in 2016. He has also served as the mayor of Baltimore.
","O’Malley said, ""Fifty years ago, the average GM employee could pay for a year of a son or daughter’s college tuition on just two weeks wages."" ",Louis Jacobson,https://www.politifact.com/factchecks/2016/jan/25/martin-omalley/could-gm-worker-afford-college-tuition-just-two-we/,mostly-true
Erick Erickson,"""Paul Ryan is one of less than a dozen Republican congressmen to have voted for every bailout to come before Congress.""
 ",Erick Erickson is the host of a conservative radio talk show based in Atlanta.,"Erickson said Ryan ""is one of less than a dozen Republican congressmen to have voted for every bailout to come before Congress."" Ryan was one of 20 GOP House members who voted for TARP and for a related auto industry bailout measure that did not become law, although he is only one of only five of those members who are still in the House. On the other hand, Ryan voted against the bailout of Freddie Mac and Fannie Mae. ",Tom Kertscher,https://www.politifact.com/factchecks/2015/oct/15/erick-erickson/paul-ryan-one-few-gop-house-members-have-voted-eve/,barely-true
Bernie Sanders,"The largest low-wage employer ""is not McDonalds or Walmart but the U.S. government.""
 ","Bernie Sanders is a senator from Vermont. Sanders was first elected to the Senate in 2007 and was re-elected in 2012 and 2018. The senator also ran an unsuccessful presidential campaign in 2016, losing the Democratic primary to Hillary Clinton. From 1991 until 2007, he was the representative of Vermont’s At-Large District of the House of Representatives. Sanders was the mayor of Burlington from 1981 to 1989. He received a bachelor’s degree in political science from the University of Chicago. In 2019, he announced he was running for the Democratic nomination for president and dropped out in April 2020.","Sanders said that ""the largest low-wage employer is not McDonalds or Walmart but the US government."" Measured by the raw numbers, more federal contract workers make less than $12 an hour than workers at Walmart and McDonalds combined. But he is incorrect to suggest these workers are directly employed by the U.S. government, as they actually work for private companies. In addition, a much smaller percentage of federal contract workers make less than $12 an hour when compared to McDonald’s and Walmart. In terms of actual government employees, the U.S. government has historically paid low-skill federal civilian workers more than similar occupations in the private sector. ",Clayton Youngman,https://www.politifact.com/factchecks/2015/sep/29/bernie-sanders/bernie-sanders-says-federal-government-not-mcdonal/,barely-true
The Commonwealth Institute,"Says ""roughly two-thirds of (state) corporations didn’t pay any income tax in Virginia.""","The Commonwealth Institute provides independent research and of state fiscal and economic policies in Virginia with a focus on how they affect middle class and low income people. The Commonwealth Institute is the State Priorities Partnership (SPP) group for Virginia, part of a national network of nonpartisan, independent, nonprofit organizations in over 40 states. The SPP network is coordinated by the Center on Budget and Policy Priorities, a Washington-based research organization and strategic policy institute that works on a range of federal and state issues.
","The Commonwealth Institute said ""At last count, roughly two-thirds of corporations didn’t pay any income tax."" It’s correct that two-thirds of corporate filers wound up owing zero income tax, according to the most recent report on the issue by the state Department of Taxation and another by JLARC. Many profitable companies can avoid the levy by claiming deductions. But the institute leaves out information. Many corporations don’t pay because they’ve stopped operating in the state, yet are still required by law to file a return.  JLARC, after weeding out those businesses in 2010, found that 44 percent of active corporations didn’t pay income tax. ",Sean Gorman,https://www.politifact.com/factchecks/2015/may/27/commonwealth-institute/commonwealth-institute-says-most-va-corporations-d/,mostly-true
Anonymous cyber-squatter,"After laying off 30,000 people, Carly Fiorina said that in retrospect, ""I would have done them all faster.""","This website pranked Republican Carly Fiorina around the time she announced her presidential bid in 2015.
","The cyber-squatter site claims that after laying off ""30,000 people,"" Carly Fiorina said that in retrospect, ""I would have done them all faster."" ",Louis Jacobson,https://www.politifact.com/factchecks/2015/may/05/anonymous-cyber-squatter/cyber-squatter-accuses-carly-fiorina-30000-layoffs/,half-true
Erick Erickson,"Say Apple’s Tim Cook ""will not do business with Indiana.""",Erick Erickson is the host of a conservative radio talk show based in Atlanta.,"In trying to call out Apple’s Cook for clashing business practices over gay rights, Erickson said Cook ""will not do business with Indiana.""   That is not true based on Cook’s public remarks on Twitter and in an op-ed. Cook has been outspoken in his position against the law and others like it across the country, but Apple stores remain open in Indiana and iPhones, iMacs and everything else is still being sold. ",Katie Sanders,https://www.politifact.com/factchecks/2015/apr/02/erick-erickson/redstate-editor-decries-apple-chief-not-doing-busi/,false
Jon Erpenbach,"""In general, it appears"" Wisconsin’s right to work bill would ""likely apply to"" the Green Bay Packers players and their union.","
Jon Erpenbach is a Democratic member of the Wisconsin state Senate. He was elected to a Madison-area district in 1998.","Erpenbach said: ""In general, it appears"" Wisconsin’s right to work bill would ""likely apply to"" the Green Bay Packers players and their union. The nonpartisan state Legislative Council arrived at that conclusion -- though, as a practical matter, it’s not clear the bill would have any noticeable effect on the players union. ------ More on Scott Walker For profiles and stories on Scott Walker and 2016 presidential politics, go to the Milwaukee Journal Sentinel's Scott Walker page. To comment on this item, go to the Milwaukee Journal Sentinel’s web page. ",Tom Kertscher,https://www.politifact.com/factchecks/2015/feb/27/jon-erpenbach/would-wisconsins-right-work-bill-affect-green-bay-/,mostly-true
